{
  "$schema": "https://json-schema.org/draft/2020-12/schema",
  "$id": "https://animundo-builder/contracts/plan.schema.json",
  "title": "One border plan: what the tile needs and what that costs",
  "type": "object",
  "additionalProperties": false,
  "required": [
    "format",
    "tile",
    "code_only",
    "items",
    "improve",
    "estimate_usd",
    "name",
    "coming",
    "world",
    "planned_at"
  ],
  "properties": {
    "format": {"const": 1},
    "tile": {"type": "string", "pattern": "^[ns]_[0-9]{3}_[0-9]{3}$"},
    "code_only": {"type": "boolean"},
    "items": {
      "type": "array",
      "items": {
        "type": "object",
        "additionalProperties": false,
        "required": ["id", "kind", "what", "from", "estimate_usd"],
        "properties": {
          "id": {"type": "string", "minLength": 1},
          "kind": {"enum": ["home", "animal", "plant", "food"]},
          "what": {"type": "string", "minLength": 1},
          "from": {"type": "string", "minLength": 1},
          "estimate_usd": {"type": "number", "minimum": 0}
        }
      }
    },
    "improve": {
      "type": "array",
      "maxItems": 2,
      "items": {
        "type": "object",
        "additionalProperties": false,
        "required": ["id", "kind", "what", "from", "estimate_usd"],
        "properties": {
          "id": {"type": "string", "minLength": 1},
          "kind": {"enum": ["home", "animal", "plant", "food"]},
          "what": {"type": "string", "minLength": 1},
          "from": {"type": "string", "minLength": 1},
          "estimate_usd": {"type": "number", "minimum": 0}
        }
      }
    },
    "estimate_usd": {"type": "number", "minimum": 0},
    "name": {
      "type": "object",
      "additionalProperties": false,
      "required": ["en", "fi"],
      "properties": {
        "en": {"type": "string", "minLength": 1},
        "fi": {"type": "string", "minLength": 1}
      }
    },
    "country": {"type": "string", "minLength": 1},
    "region_id": {"type": "string", "pattern": "^[a-z]{2}_[a-z0-9_]+$"},
    "coming": {
      "type": "array",
      "items": {"type": "string", "pattern": "^[a-z][a-z0-9_]*$"}
    },
    "looked_for": {
      "description": "Habitat-fitting library animals asked about on an improve but in neither the answer nor the place: enrich candidates without --want (#167.4).",
      "type": "array",
      "items": {"type": "string", "pattern": "^[a-z][a-z0-9_]*$"}
    },
    "world": {"type": "string", "minLength": 1},
    "planned_at": {"type": "string", "minLength": 1},
    "blocked": {
      "description": "Why nothing can be built here yet: a reason for the game to show, or, for a place plan, the surveyed animals the builder can't make.",
      "anyOf": [
        {"type": "string", "minLength": 1},
        {
          "type": "array",
          "items": {
            "type": "object",
            "additionalProperties": false,
            "required": ["what", "reason"],
            "properties": {
              "what": {"type": "string", "minLength": 1},
              "reason": {"enum": ["needs_reference", "not_makeable", "not_a_plant"]}
            }
          }
        }
      ]
    },
    "survey": {
      "description": "For a place plan: the path of its survey.json.",
      "type": "string",
      "minLength": 1
    }
  }
}
