{
  "format": 1,
  "tile": "s_530_612",
  "code_only": false,
  "items": [
    {
      "id": "home_reef",
      "kind": "home",
      "what": "reef",
      "from": "examples/reef",
      "estimate_usd": 0.2
    }
  ],
  "improve": [],
  "blocked": [],
  "survey": "survey.json",
  "estimate_usd": 0.2,
  "name": {
    "en": "Green Island Reef",
    "fi": "Green Islandin riutta"
  },
  "country": "Australia",
  "region_id": "au_great_barrier_reef",
  "coming": [
    "clownfish",
    "green_sea_turtle",
    "reef_shark",
    "manta_ray"
  ],
  "world": "fixture",
  "planned_at": "2026-10-30T07:55:24.248090+00:00"
}
